{
  "acceptance": [
    "Against a local server, `expectBody` on an `http-get:` resource keeps waiting while the GET body does not contain the text, then succeeds once it does; a RegExp works the same way in the API.",
    "It fails with the usual timeout error when the body never matches.",
    "The options check rejects `expectBody` on a HEAD (`http:` or `https:`) resource straight away, with a clear message that names `expectBody` and the `-get` form to use instead.",
    "The CLI takes `--expect-body <text>`, exits 0 once the body matches and non-zero on a timeout.",
    "bin/usage.txt, README.md and index.d.ts document the option, the type tests cover it, and `npm test` (lint, types and mocha) passes."
  ],
  "assignee": null,
  "baseCommit": "3274b94371d17b305d956ea9b810a1cdc9e8de65",
  "branch": "stint/T-0001",
  "budgets": {
    "implementer": 150000,
    "learn": 20000,
    "planner": 40000,
    "reviewer": 30000
  },
  "createdAt": "2026-10-29T17:31:25.916Z",
  "goal": "Add an `expectBody` option (a substring, or a RegExp in the API) and a `--expect-body` CLI flag, so `http-get:` and `https-get:` resources count as available only once the response body contains the text.",
  "id": "T-0001",
  "links": {
    "beadsId": null,
    "issueUrl": null
  },
  "pendingAsk": null,
  "risk": "low",
  "slug": "match-http-response-bodies",
  "status": "awaiting_approval",
  "testCommand": "npm test",
  "title": "Match HTTP response bodies",
  "updatedAt": "2026-10-29T17:37:32.014Z",
  "version": "stint.task/1"
}
