{
  "acceptance": [
    "`toSeconds('90s')` is 90, `toSeconds('2m')` is 120 and `toSeconds(1500)` is 1.",
    "README.md documents it.",
    "Both test runs pass with coverage at 100%."
  ],
  "assignee": null,
  "baseCommit": "afa732ea169da30d2b7fffd784c4151f446b3dcc",
  "branch": "stint/T-0001",
  "budgets": {
    "implementer": 150000,
    "learn": 20000,
    "planner": 40000,
    "reviewer": 30000
  },
  "createdAt": "2026-10-29T15:43:08.337Z",
  "goal": "Export `toSeconds(value)` from src/index.ts: the whole number of seconds, rounded down, in a duration string or a number of milliseconds.",
  "id": "T-0001",
  "links": {
    "beadsId": null,
    "issueUrl": null
  },
  "pendingAsk": null,
  "risk": "medium",
  "slug": "add-toseconds",
  "status": "done",
  "tags": [
    "durations"
  ],
  "testCommand": "npm run test:nodejs && npm run test:edge",
  "title": "Add toSeconds()",
  "updatedAt": "2026-10-29T15:45:17.402Z",
  "version": "stint.task/1"
}
