{
  "acceptance": [
    "`['1h', '5m', '30s'].sort(compare)` is `['30s', '5m', '1h']`, and `compare('60s', '1m')` is 0.",
    "README.md documents it.",
    "Both test runs pass with coverage at 100%."
  ],
  "assignee": null,
  "baseCommit": "f6147fa13eebbe35479143527c4c9fa0cdd39a63",
  "branch": "stint/T-0004",
  "budgets": {
    "implementer": 150000,
    "learn": 20000,
    "planner": 40000,
    "reviewer": 30000
  },
  "createdAt": "2026-10-29T15:50:41.427Z",
  "goal": "Export `compare(a, b)` from src/index.ts, a sort comparator for durations given as strings or numbers of milliseconds.",
  "id": "T-0004",
  "links": {
    "beadsId": null,
    "issueUrl": null
  },
  "pendingAsk": null,
  "risk": "medium",
  "slug": "add-compare",
  "status": "done",
  "tags": [
    "durations"
  ],
  "testCommand": "npm run test:nodejs && npm run test:edge",
  "title": "Add compare()",
  "updatedAt": "2026-10-29T15:54:32.576Z",
  "version": "stint.task/1"
}
