{
  "acceptance": [
    "`average(['1m', '3m'])` is 120000 and `average([1000, '3s'])` is 2000.",
    "README.md documents it.",
    "Both test runs pass with coverage at 100%."
  ],
  "assignee": null,
  "baseCommit": "48efb0298416561caa9c06ea3867d866cb65b536",
  "branch": "stint/T-0007",
  "budgets": {
    "implementer": 150000,
    "learn": 20000,
    "planner": 40000,
    "reviewer": 30000
  },
  "createdAt": "2026-10-29T15:58:55.388Z",
  "goal": "Export `average(values)` from src/index.ts: the mean in milliseconds of a list of durations.",
  "id": "T-0007",
  "links": {
    "beadsId": null,
    "issueUrl": null
  },
  "pendingAsk": null,
  "risk": "medium",
  "slug": "add-average",
  "status": "done",
  "tags": [
    "durations"
  ],
  "testCommand": "npm run test:nodejs && npm run test:edge",
  "title": "Add average()",
  "updatedAt": "2026-10-29T16:01:20.808Z",
  "version": "stint.task/1"
}
